{
  "run_type": "compare_backends",
  "backend_selected": "stats_ets",
  "candidate_backends": [
    "stats_ets",
    "seasonal_naive",
    "ml_ridge",
    "naive",
    "stats_arima",
    "moving_average",
    "stream_ewm"
  ],
  "feature_spec": {
    "mode": "auto",
    "lags": [
      1,
      2,
      3,
      7,
      14,
      21,
      28
    ],
    "lag_points": [],
    "lag_step": null,
    "lag_count": null,
    "rolling_windows": [
      3,
      7,
      14
    ],
    "include_calendar": true,
    "calendar_features": [
      "dayofweek",
      "month",
      "day",
      "dayofyear",
      "is_month_start",
      "is_month_end",
      "ordinal",
      "sin_dayofyear",
      "cos_dayofyear"
    ],
    "include_tsfresh": false,
    "tsfresh_window": 30,
    "tsfresh_features": [],
    "include_exogenous": true,
    "exogenous_cols": [
      "complaints",
      "event_index"
    ]
  },
  "inputs": {
    "name": "transit_demand_shock",
    "horizon": 14,
    "strategy": "fast",
    "mode": "benchmark",
    "strict_backend": true,
    "allow_backend_substitution": false,
    "source": "package_data/datasets/transit_demand_shock.csv",
    "date_col": "ds",
    "value_col": "y",
    "series_kind": "price",
    "candidate_backends": [
      "naive",
      "seasonal_naive",
      "moving_average",
      "stream_ewm",
      "ml_ridge",
      "stats_arima",
      "stats_ets"
    ],
    "routing": {
      "profile": "explicit",
      "history_len": 140,
      "horizon": 14,
      "candidate_backends": [
        "naive",
        "seasonal_naive",
        "moving_average",
        "stream_ewm",
        "ml_ridge",
        "stats_arima",
        "stats_ets"
      ],
      "missing_backends": [],
      "recommended_extras": [],
      "reason": "explicit_backends_provided"
    }
  },
  "summary": {
    "headline": "transit_demand_shock: stats_ets won the backend comparison and produced a publishable pack.",
    "latest_observed": 122.84,
    "projected_end": 122.7506031915317,
    "artifact_count": 11,
    "narrative": "Compared 7 backend(s) and routed the series to 'stats_ets'. Exported CSV, chart, card, markdown, and JSON artifacts.",
    "conformal_method": "residual_heuristic",
    "routing_reason": "explicit_backends_provided"
  },
  "diagnostics": {
    "leaderboard": [
      {
        "backend_id": "stats_ets",
        "mae": 4.297792,
        "rmse": 4.877928,
        "mape": 3.936886,
        "smape": 3.965517,
        "coverage_80": 1.0,
        "avg_width_80": 22.106379,
        "wnc_80": 5.337341,
        "coverage_90": 1.0,
        "avg_width_90": 28.372958,
        "wnc_90": 4.158512,
        "backtest_horizon": 14
      },
      {
        "backend_id": "seasonal_naive",
        "mae": 5.152143,
        "rmse": 6.286453,
        "mape": 4.493941,
        "smape": 4.544091,
        "coverage_80": 0.857143,
        "avg_width_80": 25.711823,
        "wnc_80": 3.933353,
        "coverage_90": 0.928571,
        "avg_width_90": 33.000451,
        "wnc_90": 3.319999,
        "backtest_horizon": 14
      },
      {
        "backend_id": "ml_ridge",
        "mae": 9.412687,
        "rmse": 11.829363,
        "mape": 7.557447,
        "smape": 7.309462,
        "coverage_80": 1.0,
        "avg_width_80": 151.03139,
        "wnc_80": 0.781224,
        "coverage_90": 1.0,
        "avg_width_90": 193.84483,
        "wnc_90": 0.608679,
        "backtest_horizon": 14
      },
      {
        "backend_id": "naive",
        "mae": 17.889286,
        "rmse": 22.599682,
        "mape": 18.209859,
        "smape": 16.0135,
        "coverage_80": 1.0,
        "avg_width_80": 145.849575,
        "wnc_80": 0.808979,
        "coverage_90": 1.0,
        "avg_width_90": 187.194106,
        "wnc_90": 0.630304,
        "backtest_horizon": 14
      },
      {
        "backend_id": "stats_arima",
        "mae": 19.850545,
        "rmse": 22.116249,
        "mape": 18.906309,
        "smape": 17.702284,
        "coverage_80": 1.0,
        "avg_width_80": 143.366971,
        "wnc_80": 0.822988,
        "coverage_90": 1.0,
        "avg_width_90": 184.007749,
        "wnc_90": 0.641219,
        "backtest_horizon": 14
      },
      {
        "backend_id": "moving_average",
        "mae": 20.265,
        "rmse": 22.421822,
        "mape": 19.182111,
        "smape": 18.057076,
        "coverage_80": 1.0,
        "avg_width_80": 145.849575,
        "wnc_80": 0.808979,
        "coverage_90": 1.0,
        "avg_width_90": 187.194106,
        "wnc_90": 0.630304,
        "backtest_horizon": 14
      },
      {
        "backend_id": "stream_ewm",
        "mae": 22.047328,
        "rmse": 23.201494,
        "mape": 20.036085,
        "smape": 19.641865,
        "coverage_80": 1.0,
        "avg_width_80": 172.918328,
        "wnc_80": 0.682341,
        "coverage_90": 1.0,
        "avg_width_90": 221.93614,
        "wnc_90": 0.531636,
        "backtest_horizon": 14
      }
    ],
    "conformal": {
      "enabled": false,
      "requested_method": "auto",
      "method": "residual_heuristic",
      "levels": [
        80,
        90
      ],
      "calibration_window": 200,
      "warmup_min": 40,
      "symmetric": true,
      "horizon_aware": true,
      "effective_horizon_aware": false,
      "calibration_size": 14,
      "native_levels": [],
      "fallback_reason": null,
      "backend_id": "stats_ets",
      "coverage_backtest": {
        "80": 1.0,
        "90": 1.0
      },
      "mean_interval_width": {
        "80": 22.106379,
        "90": 28.372958
      },
      "width_normalized_coverage": {
        "80": 5.337341,
        "90": 4.158512
      },
      "backend_tags": [
        "accurate",
        "long_horizon"
      ]
    },
    "conformal_by_backend": {
      "naive": {
        "enabled": false,
        "requested_method": "auto",
        "method": "residual_heuristic",
        "levels": [
          80,
          90
        ],
        "calibration_window": 200,
        "warmup_min": 40,
        "symmetric": true,
        "horizon_aware": true,
        "effective_horizon_aware": false,
        "calibration_size": 14,
        "native_levels": [],
        "fallback_reason": null,
        "backend_id": "naive",
        "coverage_backtest": {
          "80": 1.0,
          "90": 1.0
        },
        "mean_interval_width": {
          "80": 145.849575,
          "90": 187.194106
        },
        "width_normalized_coverage": {
          "80": 0.808979,
          "90": 0.630304
        },
        "backend_tags": [
          "fast",
          "low_data"
        ]
      },
      "seasonal_naive": {
        "enabled": false,
        "requested_method": "auto",
        "method": "residual_heuristic",
        "levels": [
          80,
          90
        ],
        "calibration_window": 200,
        "warmup_min": 40,
        "symmetric": true,
        "horizon_aware": true,
        "effective_horizon_aware": false,
        "calibration_size": 14,
        "native_levels": [],
        "fallback_reason": null,
        "backend_id": "seasonal_naive",
        "coverage_backtest": {
          "80": 0.857143,
          "90": 0.928571
        },
        "mean_interval_width": {
          "80": 25.711823,
          "90": 33.000451
        },
        "width_normalized_coverage": {
          "80": 3.933353,
          "90": 3.319999
        },
        "backend_tags": [
          "fast",
          "long_horizon"
        ]
      },
      "moving_average": {
        "enabled": false,
        "requested_method": "auto",
        "method": "residual_heuristic",
        "levels": [
          80,
          90
        ],
        "calibration_window": 200,
        "warmup_min": 40,
        "symmetric": true,
        "horizon_aware": true,
        "effective_horizon_aware": false,
        "calibration_size": 14,
        "native_levels": [],
        "fallback_reason": null,
        "backend_id": "moving_average",
        "coverage_backtest": {
          "80": 1.0,
          "90": 1.0
        },
        "mean_interval_width": {
          "80": 145.849575,
          "90": 187.194106
        },
        "width_normalized_coverage": {
          "80": 0.808979,
          "90": 0.630304
        },
        "backend_tags": [
          "fast"
        ]
      },
      "stream_ewm": {
        "enabled": false,
        "requested_method": "auto",
        "method": "residual_heuristic",
        "levels": [
          80,
          90
        ],
        "calibration_window": 200,
        "warmup_min": 40,
        "symmetric": true,
        "horizon_aware": true,
        "effective_horizon_aware": false,
        "calibration_size": 14,
        "native_levels": [],
        "fallback_reason": null,
        "backend_id": "stream_ewm",
        "coverage_backtest": {
          "80": 1.0,
          "90": 1.0
        },
        "mean_interval_width": {
          "80": 172.918328,
          "90": 221.93614
        },
        "width_normalized_coverage": {
          "80": 0.682341,
          "90": 0.531636
        },
        "backend_tags": [
          "streaming",
          "fast",
          "low_data"
        ]
      },
      "ml_ridge": {
        "enabled": false,
        "requested_method": "auto",
        "method": "residual_heuristic",
        "levels": [
          80,
          90
        ],
        "calibration_window": 200,
        "warmup_min": 40,
        "symmetric": true,
        "horizon_aware": true,
        "effective_horizon_aware": false,
        "calibration_size": 14,
        "native_levels": [],
        "fallback_reason": null,
        "backend_id": "ml_ridge",
        "coverage_backtest": {
          "80": 1.0,
          "90": 1.0
        },
        "mean_interval_width": {
          "80": 151.03139,
          "90": 193.84483
        },
        "width_normalized_coverage": {
          "80": 0.781224,
          "90": 0.608679
        },
        "backend_tags": [
          "fast",
          "low_data",
          "tabular"
        ]
      },
      "stats_arima": {